[
  {
    "exp_id": "exp-a1f83c2d9e01",
    "title": "Recover sold-out hero SKUs",
    "pillar": "Conversion",
    "affected_surface": "Teas collection grid",
    "url": "https://zenrojas.com/collections/teas",
    "evidence": "audits/aud_3601e39cfe6f4682/screenshots/61e96e8f-collections-teas.png",
    "hypothesis": "CVR improves by replacing dead-end Sold Out tiles with waitlist, alternates, or bundle substitutes. Collection shows Organic Sleep Tea, Heartburn Tea, Premium Sencha, and Unwind marked Sold Out while samplers remain available.",
    "primary_change": "On sold-out tiles, show Notify me, Try sampler ($2), or Shop similar blend with one-click add.",
    "primary_kpi": "Collection click-through to in-stock PDP",
    "decision_rule": "Ship if collection CTR to purchasable SKUs rises without increasing bounce.",
    "expected_lift": "+10–18%",
    "confidence": 82
  },
  {
    "exp_id": "exp-b2e94d3e0f12",
    "title": "Bundle ritual starter under $50 threshold",
    "pillar": "AOV",
    "affected_surface": "Homepage ritual section",
    "url": "https://zenrojas.com/",
    "evidence": "audits/aud_3601e39cfe6f4682/screenshots/361e7ba3-home.png",
    "hypothesis": "AOV and conversion rise when homepage ritual block becomes a shoppable bundle crossing the free-shipping threshold. Banner states FREE SHIPPING ON ALL $50+ ORDERS; ritual items (infuser $5, mug $8, tea bags $5) are priced below threshold individually.",
    "primary_change": "Add Steep Into Something Sacred bundle: one tea + infuser + mug at $52 with free shipping callout.",
    "primary_kpi": "AOV (homepage visitors)",
    "decision_rule": "Ship if AOV rises ≥$6 and bundle attach rate ≥8% without hurting homepage bounce.",
    "expected_lift": "+12–20%",
    "confidence": 78
  },
  {
    "exp_id": "exp-c3f05e4f1a23",
    "title": "Mission-first homepage cards",
    "pillar": "Conversion",
    "affected_surface": "Homepage need blocks",
    "url": "https://zenrojas.com/",
    "evidence": "audits/aud_3601e39cfe6f4682/screenshots/361e7ba3-home-mobile.png",
    "hypothesis": "CVR improves when need blocks (Sleep, Immune, Energy, Digestion) include price, stock status, and add-to-cart inline. Homepage already segments by mission but routes to SHOP links without inline purchase.",
    "primary_change": "Add price, stock badge, and Add to cart on each mission card; gray out sold-out with waitlist.",
    "primary_kpi": "Homepage add-to-cart rate",
    "decision_rule": "Ship if homepage ATC rate improves without hurting PDP conversion.",
    "expected_lift": "+8–15%",
    "confidence": 76
  },
  {
    "exp_id": "exp-d4a16f502b34",
    "title": "Sampler-to-loose-leaf upsell",
    "pillar": "AOV",
    "affected_surface": "Sampler PDPs",
    "url": "https://zenrojas.com/products/organicsleeptea",
    "evidence": "audits/aud_3601e39cfe6f4682/screenshots/a1ec8fc2-products-organicsleeptea.png",
    "hypothesis": "AOV rises when $2 samplers surface a one-click upgrade to $12–$13 loose-leaf bag on PDP and post-add-to-cart. Collection promotes Zen Rojas Loose Leaf Samplers From $2 adjacent to full-size teas.",
    "primary_change": "On sampler and full-size PDPs, show Try sampler / Upgrade to full bag module with savings copy.",
    "primary_kpi": "Sampler-to-full-size conversion rate",
    "decision_rule": "Ship if upgrade rate ≥15% without cannibalizing full-size first-purchase CVR.",
    "expected_lift": "+9–14%",
    "confidence": 74
  },
  {
    "exp_id": "exp-e5b27a613c45",
    "title": "Empty cart ritual nudge",
    "pillar": "Performance",
    "affected_surface": "Cart page",
    "url": "https://zenrojas.com/cart",
    "evidence": "audits/aud_3601e39cfe6f4682/screenshots/8e32a388-cart.png",
    "hypothesis": "Cart abandonment drops when empty cart shows best-sellers and free-shipping progress instead of a dead end. Cart page shows Your cart is currently empty with only Continue browsing.",
    "primary_change": "Replace empty cart with 3 in-stock picks, $50 free-shipping progress bar, and sampler entry.",
    "primary_kpi": "Empty-cart recovery rate",
    "decision_rule": "Ship if empty-cart sessions adding an item rise ≥20% without hurting checkout start rate.",
    "expected_lift": "+10–16%",
    "confidence": 80
  },
  {
    "exp_id": "exp-f6c38b724d56",
    "title": "Veteran story subscription hook",
    "pillar": "Retention",
    "affected_surface": "About page + post-purchase",
    "url": "https://zenrojas.com/pages/aboutus",
    "evidence": "audits/aud_3601e39cfe6f4682/screenshots/7464325c-pages-aboutus.png",
    "hypothesis": "Repeat purchase rate improves by tying veteran-owned brand story to a monthly tea ritual subscription. About page emphasizes calm ritual and 100% organic sourcing — strong retention narrative without reorder mechanic.",
    "primary_change": "Add Monthly Ritual Box subscription CTA on About and order confirmation with blend rotation.",
    "primary_kpi": "90-day repeat purchase rate",
    "decision_rule": "Ship if 90-day repeat rate improves without increasing churn on first order.",
    "expected_lift": "+6–12%",
    "confidence": 68
  },
  {
    "exp_id": "exp-a7d49c835e67",
    "title": "Sleep landing page for paid search",
    "pillar": "Acquisition",
    "affected_surface": "New /sleep-tea/ landing",
    "url": "https://zenrojas.com/pages/sleep-tea/",
    "evidence": "audits/aud_3601e39cfe6f4682/screenshots/a1ec8fc2-products-organicsleeptea.png",
    "hypothesis": "Paid and organic sleep-intent traffic converts better on a dedicated landing page than a sold-out collection tile. Organic Sleep Tea PDP has rich chamomile/passionflower copy but collection marks SKU sold out.",
    "primary_change": "Launch /sleep-tea/ with PDP copy, reviews, waitlist, and sampler fallback.",
    "primary_kpi": "Landing-page conversion rate",
    "decision_rule": "Ship if sleep landing CVR beats collection entry by ≥25%.",
    "expected_lift": "+14–22%",
    "confidence": 71
  },
  {
    "exp_id": "exp-b8e5ad946f78",
    "title": "Immune wellness content hub",
    "pillar": "Acquisition",
    "affected_surface": "Bodyguard tea content hub",
    "url": "https://zenrojas.com/products/bodyguardtea",
    "evidence": "audits/aud_3601e39cfe6f4682/screenshots/91d6cb7e-products-bodyguardtea.png",
    "hypothesis": "Organic acquisition rises with an immune-support hub matching Bodyguard's ingredient story. Bodyguard PDP details sencha, ginger, elderflower benefits — no standalone SEO hub.",
    "primary_change": "Create /immune-support/ hub linking Bodyguard PDP, brewing guide, and sampler.",
    "primary_kpi": "Organic traffic to purchasable SKUs",
    "decision_rule": "Ship if hub drives ≥500 organic sessions/month with CVR ≥ collection average.",
    "expected_lift": "+8–14%",
    "confidence": 70
  },
  {
    "exp_id": "exp-c9f6be057a89",
    "title": "Reorder email for in-stock SKUs",
    "pillar": "Retention",
    "affected_surface": "Post-purchase email",
    "url": "https://zenrojas.com/products/bodyguardtea",
    "evidence": "audits/aud_3601e39cfe6f4682/screenshots/91d6cb7e-products-bodyguardtea-mobile.png",
    "hypothesis": "Repeat purchase rate improves with timed reorder prompts based on 20-cup bag consumption. Bodyguard PDP states 20 cups (40g) per bag and daily use instructions — natural reorder window.",
    "primary_change": "Send day-25 reorder email with one-click cart prefilled for last purchase.",
    "primary_kpi": "30-day repeat purchase rate",
    "decision_rule": "Ship if repeat rate rises ≥5pp without increasing unsubscribe rate.",
    "expected_lift": "+7–11%",
    "confidence": 72
  },
  {
    "exp_id": "exp-d0a7cf168b90",
    "title": "Add product structured data",
    "pillar": "Performance",
    "affected_surface": "PDP templates",
    "url": "https://zenrojas.com/products/bodyguardtea",
    "evidence": "audits/aud_3601e39cfe6f4682/screenshots/91d6cb7e-products-bodyguardtea.png",
    "hypothesis": "Organic CTR and rich results improve when Product JSON-LD is present on in-stock PDPs. Technical crawl found no JSON-LD on captured pages.",
    "primary_change": "Add Product schema (price, availability, reviews) to all PDP templates.",
    "primary_kpi": "Organic CTR from search",
    "decision_rule": "Ship if rich-result impressions appear within 30 days without markup errors.",
    "expected_lift": "+5–10%",
    "confidence": 85
  }
]
