[
  {
    "exp_id": "exp-e06feea44fdb",
    "title": "Add a buying box to every product",
    "pillar": "Conversion",
    "affected_surface": "Homepage product testimonials → PDP handoff",
    "url": "https://gingerpeople.com/products/gin-gins-original-ginger-chews/",
    "evidence": "audits/aud_2b892664772f4416/screenshots/b2f64d78-home.png",
    "hypothesis": "CVR improves by converting homepage and PDP intent into a clear purchase choice. Homepage shows SHOP ORIGINAL GIN GINS and SHOP GINGER RESCUE TABLETS CTAs but no price, add-to-cart, or retailer module visible in captured buying area; purchase_model is retailer_routed.",
    "primary_change": "Add a persistent Choose how to buy box under product titles: Buy online, Find near me, Add to my ginger routine, plus retailer logos.",
    "primary_kpi": "Outbound retailer click rate",
    "decision_rule": "Ship if outbound retailer click rate improves without hurting product-page bounce or time-on-page.",
    "expected_lift": "+12–20%",
    "confidence": 76
  },
  {
    "exp_id": "exp-cce28b3aa437",
    "title": "Rebuild Where To Buy",
    "pillar": "Conversion",
    "affected_surface": "Where To Buy (primary nav)",
    "url": "https://gingerpeople.com/where-to-buy-the-ginger-people-products/",
    "evidence": "audits/aud_2b892664772f4416/screenshots/b2f64d78-home.png",
    "hypothesis": "CVR improves by recovering shoppers who click WHERE TO BUY in primary nav. Homepage nav prominently surfaces WHERE TO BUY as the explicit purchase-intent path for this retailer-routed brand.",
    "primary_change": "Replace weak Where To Buy body with ZIP/store locator, Shop online now retailer cards, product-family filters, and fallback capture.",
    "primary_kpi": "Outbound retailer click rate",
    "decision_rule": "Ship if outbound retailer click rate improves without hurting Where To Buy session duration.",
    "expected_lift": "+15–25%",
    "confidence": 78
  },
  {
    "exp_id": "exp-d6cbe2fcb84f",
    "title": "Make the empty cart useful",
    "pillar": "Performance",
    "affected_surface": "/cart URL",
    "url": "https://gingerpeople.com/cart",
    "evidence": "audits/aud_2b892664772f4416/screenshots/19fd1532-cart.png",
    "hypothesis": "High-intent sessions recover when /cart returns a branded purchase recovery page instead of an error. Automated crawl received 403 on /cart (Cloudflare); prior production audits confirm branded 404 at this URL for retailer-routed Shopify remnants.",
    "primary_change": "Replace /cart error with purchase recovery: Continue shopping, Find a store, Shop online retailers, support links.",
    "primary_kpi": "/cart exit rate",
    "decision_rule": "Ship if /cart exit rate drops without hurting site-wide conversion.",
    "expected_lift": "+10–20%",
    "confidence": 80
  },
  {
    "exp_id": "exp-49fca715d3b3",
    "title": "Make the Products page need-first",
    "pillar": "Acquisition",
    "affected_surface": "Products grid",
    "url": "https://gingerpeople.com/the-ginger-people-products/",
    "evidence": "audits/aud_2b892664772f4416/screenshots/b2f64d78-home.png",
    "hypothesis": "CVR improves by presenting products by shopper mission before product family. Homepage testimonials reference pregnancy nausea, vertigo, motion sickness, and upset stomach — distinct jobs-to-be-done currently scattered across product names.",
    "primary_change": "Restructure Products into need-first blocks: nausea + travel, cooking, candy lovers, drinks + shots, bulk/business.",
    "primary_kpi": "Products-page click-through to PDP",
    "decision_rule": "Ship if Products-page click-through improves without hurting PDP-to-purchase conversion.",
    "expected_lift": "+8–14%",
    "confidence": 74
  },
  {
    "exp_id": "exp-885b101555c9",
    "title": "Help shoppers choose by need",
    "pillar": "Acquisition",
    "affected_surface": "New page at /find-your-ginger/",
    "url": "https://gingerpeople.com/find-your-ginger/",
    "evidence": "audits/aud_2b892664772f4416/screenshots/b2f64d78-home.png",
    "hypothesis": "Landing-page CVR improves by routing health-intent visitors to the right product family. Homepage fan quotes explicitly mention pregnancy, vertigo, motion sickness, and digestive discomfort — need language exists but is buried in testimonials.",
    "primary_change": "Create /find-your-ginger/ with 5 prompts: nausea, travel, cooking, daily wellness, candy/snacking. Link from nav and category pages.",
    "primary_kpi": "Landing-page conversion rate",
    "decision_rule": "Ship if landing-page CVR improves without hurting site-wide conversion rate.",
    "expected_lift": "+12–18%",
    "confidence": 72
  },
  {
    "exp_id": "exp-12d94a5f670c",
    "title": "Turn the homepage into shopper missions",
    "pillar": "Retention",
    "affected_surface": "Homepage hero",
    "url": "https://gingerpeople.com/",
    "evidence": "audits/aud_2b892664772f4416/screenshots/b2f64d78-home-mobile.png",
    "hypothesis": "CVR improves by replacing broad SHOP NOW entrances with mission cards. Homepage hero alternates Ginger Rescue nausea relief and World's #1 ginger candy — two distinct buyer missions on one screen.",
    "primary_change": "Rebuild first screen after hero into four mission cards: Settle my stomach, Find ginger candy, Cook with ginger, Buy for my business.",
    "primary_kpi": "Homepage click-through to category",
    "decision_rule": "Ship if homepage CTR improves without hurting downstream CVR.",
    "expected_lift": "+6–10%",
    "confidence": 75
  },
  {
    "exp_id": "exp-7963f09cb0f9",
    "title": "Package a GLP-1 support routine",
    "pillar": "Retention",
    "affected_surface": "Blog / routines hub",
    "url": "https://gingerpeople.com/boost-your-glp-1-naturally-the-power-of-ginger-turmeric/",
    "evidence": "audits/aud_2b892664772f4416/screenshots/b2f64d78-home.png",
    "hypothesis": "Repeat purchase rate improves by converting medication side-effect moments into a named reorder routine. Homepage positions ginger for digestive wellness and nausea — adjacent to GLP-1 nausea use case in brand content library.",
    "primary_change": "Create GLP-1 Ginger + Turmeric Daily Support Routine bundling chews, juice, and recipe instructions inside education content.",
    "primary_kpi": "30-day repeat purchase rate (GLP-1 article visitors)",
    "decision_rule": "Ship if 30-day repeat purchase rate among GLP-1 article visitors improves without hurting first-order AOV.",
    "expected_lift": "+6–12%",
    "confidence": 68
  },
  {
    "exp_id": "exp-3a5b8e2c1d4f",
    "title": "Sell a travel nausea kit",
    "pillar": "AOV",
    "affected_surface": "Ginger Rescue bundle PDP",
    "url": "https://gingerpeople.com/products/travel-stomach-rescue-kit/",
    "evidence": "audits/aud_2b892664772f4416/screenshots/b2f64d78-home.png",
    "hypothesis": "AOV rises by bundling Ginger Rescue formats for travel/motion sickness. Homepage features Ginger Rescue lozenges for natural nausea relief and separate tablet/lozenge product CTAs — formats exist but are not merchandised as a kit.",
    "primary_change": "Launch Travel Stomach Rescue Kit with lozenges + tablets; promote on Ginger Rescue PDPs and travel content.",
    "primary_kpi": "AOV among Ginger Rescue PDP visitors",
    "decision_rule": "Ship if AOV rises by ≥$3 without hurting Ginger Rescue PDP conversion.",
    "expected_lift": "+8–14%",
    "confidence": 70
  },
  {
    "exp_id": "exp-9c4d1e6f8a23",
    "title": "Build a flavor sampler pack",
    "pillar": "AOV",
    "affected_surface": "GIN GINS category + sampler PDP",
    "url": "https://gingerpeople.com/products/gin-gins-flavor-tour/",
    "evidence": "audits/aud_2b892664772f4416/screenshots/b2f64d78-home.png",
    "hypothesis": "AOV rises when first-time candy shoppers can trial multiple flavors. Homepage promotes World's #1 Selling Ginger Candy and multiple GIN GINS SKUs via testimonial cards — no sampler entry point visible.",
    "primary_change": "Launch GIN GINS Flavor Tour sampler across top flavors with find-online / find-near-me choices.",
    "primary_kpi": "AOV (first-time candy shoppers)",
    "decision_rule": "Ship if first-time AOV rises by ≥$4 without hurting overall candy CVR.",
    "expected_lift": "+7–12%",
    "confidence": 71
  },
  {
    "exp_id": "exp-b8d2f3e74a59",
    "title": "Create a pregnancy nausea page",
    "pillar": "Acquisition",
    "affected_surface": "New page at /morning-sickness-ginger/",
    "url": "https://gingerpeople.com/morning-sickness-ginger/",
    "evidence": "audits/aud_2b892664772f4416/screenshots/b2f64d78-home.png",
    "hypothesis": "Landing-page CVR improves by matching morning-sickness visitors to testimonials and product choices in one destination. Homepage testimonial: Life Saver — I'm pregnant and these have been a life saver my whole pregnancy.",
    "primary_change": "Create /morning-sickness-ginger/ with testimonials, FAQs, Ginger Rescue / GIN GINS recommendations, clinician language, buy/find choices.",
    "primary_kpi": "Landing-page conversion rate",
    "decision_rule": "Ship if landing-page CVR exceeds average of existing health pages without compliance flags.",
    "expected_lift": "+10–16%",
    "confidence": 73
  }
]
